{"cameras":[{"camera":"CAM_01","interactions":[{"approach_events":1,"approach_rate_bh_per_sec":0.148,"arm_extension_score":{"note":"2D keypoint geometry proxy; not an action label","reliability":"limited","value":0.257},"bbox_overlap_fraction":1.0,"close_duration_sec":3.9,"close_fraction":1.0,"co_observed_end_sec":3.9,"co_observed_frames":5,"co_observed_start_sec":0.0,"contact_proxy":{"note":"heuristic visual proxy, not confirmed contact","reliability":"limited","value":0.51},"first_close_sec":0.0,"last_close_sec":3.9,"mean_distance_bh":0.47,"minimum_distance_bh":0.245,"rapid_limb_motion_score":{"note":"wrist displacement between sparse samples; aliasing likely, saturates easily","reliability":"limited","value":0.359},"relative_motion_when_close_bh_per_sec":0.167,"reliability":0.876,"tracks":["T2","T3"]}],"observation_window_sec":30.633,"people":{"count_max":3,"count_median":0.0,"count_min":0,"frames_with_person_fraction":0.406,"tracks_included":3,"tracks_total":4},"quality":{"cv_reliability":0.591,"cv_reliability_label":"medium","dark_frame_fraction":0.016,"detection_dropout_rate":0.298,"occlusion_proxy":0.53,"pose_visibility":0.679,"small_person_fraction":0.0,"track_fragmentation":0.667},"sampling":{"frame_count":64,"max_interval_sec":0.5,"median_interval_sec":0.5},"scene":{"authorization_known":false,"boundary_crossing":null,"boundary_semantics_available":false,"fragment_links":[],"large_spatial_transition_observed":false,"occlusion_candidate_count":4,"person_entry_observed":true,"person_exit_observed":true},"tracks":[{"ambiguous_links":1,"appearance":{"entered_frame":false,"entry":"present_at_clip_start","exit":"disappears_mid_frame","exited_frame":true},"final_posture":"standing","first_seen_sec":0.0,"initial_posture":"standing","last_seen_sec":10.2,"longest_low_posture_run_sec":0.0,"motion":{"direction_change_count":0,"large_spatial_transition":false,"longest_low_motion_interval_sec":7.3,"low_motion_fraction":0.86,"max_speed_bh_per_sec":0.304,"mean_speed_bh_per_sec":0.079,"net_displacement_fh":0.125,"stationary_fraction":0.812},"observed_frames":17,"post_transition_low_posture_sec":null,"posture_distribution":{"crouched":0.0,"horizontal":0.0,"low_posture":0.0,"standing":1.0,"unknown":0.0},"reliability":0.681,"reliability_label":"medium","strongest_vertical_transition":{"observed":false},"track_ref":"T2","visible_fraction":0.773},{"ambiguous_links":3,"appearance":{"entered_frame":false,"entry":"present_at_clip_start","exit":"disappears_mid_frame","exited_frame":true},"final_posture":"low_posture","first_seen_sec":0.0,"initial_posture":"standing","last_seen_sec":3.9,"longest_low_posture_run_sec":1.0,"motion":{"direction_change_count":0,"large_spatial_transition":false,"longest_low_motion_interval_sec":1.467,"low_motion_fraction":0.376,"max_speed_bh_per_sec":0.342,"mean_speed_bh_per_sec":0.196,"net_displacement_fh":0.24,"stationary_fraction":0.375},"observed_frames":9,"post_transition_low_posture_sec":1.0,"posture_distribution":{"crouched":0.0,"horizontal":0.0,"low_posture":0.333,"standing":0.667,"unknown":0.0},"reliability":0.712,"reliability_label":"high","strongest_vertical_transition":{"confidence":0.725,"downward_change_bh":{"note":"hip drop underestimates body lowering under steep/overhead views","reliability":"limited","value":-0.072},"duration_sec":0.467,"end_sec":2.9,"from":"standing","observed":true,"start_sec":2.433,"to":"low_posture"},"track_ref":"T3","visible_fraction":1.0},{"ambiguous_links":1,"appearance":{"entered_frame":true,"entry":"appears_mid_frame","exit":"disappears_mid_frame","exited_frame":true},"final_posture":"standing","first_seen_sec":9.7,"initial_posture":"standing","last_seen_sec":17.967,"longest_low_posture_run_sec":0.0,"motion":{"direction_change_count":1,"large_spatial_transition":false,"longest_low_motion_interval_sec":3.4,"low_motion_fraction":0.589,"max_speed_bh_per_sec":0.254,"mean_speed_bh_per_sec":0.122,"net_displacement_fh":0.031,"stationary_fraction":0.6},"observed_frames":6,"post_transition_low_posture_sec":null,"posture_distribution":{"crouched":0.0,"horizontal":0.0,"low_posture":0.0,"standing":1.0,"unknown":0.0},"reliability":0.25,"reliability_label":"low","strongest_vertical_transition":{"observed":false},"track_ref":"T4","visible_fraction":0.333}]}],"cross_camera":null,"observation_window_sec":30.633,"schema_version":"compact-decision-state-v1","task":"single"}