{"cameras":[{"camera":"CAM_01","interactions":[],"observation_window_sec":35.0,"people":{"count_max":2,"count_median":1.0,"count_min":0,"frames_with_person_fraction":0.922,"tracks_included":2,"tracks_total":3},"quality":{"cv_reliability":0.768,"cv_reliability_label":"high","dark_frame_fraction":0.0,"detection_dropout_rate":0.059,"occlusion_proxy":0.533,"pose_visibility":0.853,"small_person_fraction":0.0,"track_fragmentation":0.333},"sampling":{"frame_count":64,"max_interval_sec":0.567,"median_interval_sec":0.567},"scene":{"authorization_known":false,"boundary_crossing":null,"boundary_semantics_available":false,"fragment_links":[],"large_spatial_transition_observed":false,"occlusion_candidate_count":3,"person_entry_observed":true,"person_exit_observed":true},"tracks":[{"ambiguous_links":5,"appearance":{"entered_frame":false,"entry":"present_at_clip_start","exit":"disappears_mid_frame","exited_frame":true},"final_posture":"standing","first_seen_sec":0.0,"initial_posture":"standing","last_seen_sec":22.767,"longest_low_posture_run_sec":0.0,"motion":{"direction_change_count":1,"large_spatial_transition":false,"longest_low_motion_interval_sec":12.2,"low_motion_fraction":0.584,"max_speed_bh_per_sec":0.491,"mean_speed_bh_per_sec":0.131,"net_displacement_fh":0.059,"stationary_fraction":0.6},"observed_frames":41,"post_transition_low_posture_sec":null,"posture_distribution":{"crouched":0.0,"horizontal":0.0,"low_posture":0.0,"standing":1.0,"unknown":0.0},"reliability":0.825,"reliability_label":"high","strongest_vertical_transition":{"observed":false},"track_ref":"T1","visible_fraction":0.976},{"ambiguous_links":4,"appearance":{"entered_frame":true,"entry":"appears_mid_frame","exit":"disappears_mid_frame","exited_frame":true},"final_posture":"low_posture","first_seen_sec":22.767,"initial_posture":"standing","last_seen_sec":33.867,"longest_low_posture_run_sec":3.9,"motion":{"direction_change_count":0,"large_spatial_transition":false,"longest_low_motion_interval_sec":3.9,"low_motion_fraction":0.703,"max_speed_bh_per_sec":0.673,"mean_speed_bh_per_sec":0.149,"net_displacement_fh":0.229,"stationary_fraction":0.667},"observed_frames":19,"post_transition_low_posture_sec":3.9,"posture_distribution":{"crouched":0.0,"horizontal":0.0,"low_posture":0.316,"standing":0.684,"unknown":0.0},"reliability":0.679,"reliability_label":"medium","strongest_vertical_transition":{"confidence":0.404,"downward_change_bh":{"note":"hip drop underestimates body lowering under steep/overhead views","reliability":"limited","value":-0.102},"duration_sec":0.567,"end_sec":29.967,"from":"standing","observed":true,"start_sec":29.4,"to":"low_posture"},"track_ref":"T3","visible_fraction":0.905}]}],"cross_camera":null,"observation_window_sec":35.0,"schema_version":"compact-decision-state-v1","task":"single"}