{"cameras":[{"camera":"CAM_01","interactions":[],"observation_window_sec":35.0,"people":{"count_max":1,"count_median":1.0,"count_min":0,"frames_with_person_fraction":0.891,"tracks_included":1,"tracks_total":1},"quality":{"cv_reliability":0.94,"cv_reliability_label":"high","dark_frame_fraction":0.0,"detection_dropout_rate":0.0,"occlusion_proxy":0.0,"pose_visibility":0.971,"small_person_fraction":0.0,"track_fragmentation":0.0},"sampling":{"frame_count":64,"max_interval_sec":0.567,"median_interval_sec":0.567},"scene":{"authorization_known":false,"boundary_crossing":null,"boundary_semantics_available":false,"fragment_links":[],"large_spatial_transition_observed":true,"occlusion_candidate_count":0,"person_entry_observed":true,"person_exit_observed":false},"tracks":[{"ambiguous_links":0,"appearance":{"entered_frame":true,"entry":"appears_mid_frame","exit":"present_at_clip_end","exited_frame":false},"final_posture":"horizontal","first_seen_sec":3.9,"initial_posture":"standing","last_seen_sec":34.967,"longest_low_posture_run_sec":28.3,"motion":{"direction_change_count":0,"large_spatial_transition":true,"longest_low_motion_interval_sec":24.967,"low_motion_fraction":0.857,"max_speed_bh_per_sec":1.877,"mean_speed_bh_per_sec":0.089,"net_displacement_fh":0.557,"stationary_fraction":0.857},"observed_frames":57,"post_transition_low_posture_sec":26.1,"posture_distribution":{"crouched":0.018,"horizontal":0.877,"low_posture":0.018,"standing":0.088,"unknown":0.0},"reliability":0.945,"reliability_label":"high","strongest_vertical_transition":{"confidence":0.452,"downward_change_bh":{"note":"hip drop underestimates body lowering under steep/overhead views","reliability":"limited","value":0.192},"duration_sec":2.767,"end_sec":8.867,"from":"standing","observed":true,"start_sec":6.1,"to":"horizontal"},"track_ref":"T1","visible_fraction":1.0}]}],"cross_camera":null,"observation_window_sec":35.0,"schema_version":"compact-decision-state-v1","task":"single"}